{
  "$schema": "https://json-schema.org/draft/2020-12/schema",
  "$id": "https://github.com/MagicBude/localogue-community-data/schemas/organization-registry.schema.json",
  "title": "Localogue Community Organization Registry Entity",
  "type": "object",
  "required": ["schemaVersion", "id", "kind", "names"],
  "properties": {
    "schemaVersion": {"const": 1},
    "id": {"type": "string", "pattern": "^(group|company|maker|label)_[0-9]{6}$"},
    "kind": {"enum": ["group", "company", "maker", "label"]},
    "names": {"$ref": "#/$defs/localizedNames"},
    "aliases": {"$ref": "#/$defs/localizedAliases"},
    "parentOrganizationId": {"type": "string", "pattern": "^(group|company|maker)_[0-9]{6}$"},
    "status": {"enum": ["active", "inactive", "unknown"]},
    "foundedDate": {"$ref": "#/$defs/partialDate"},
    "closedDate": {"$ref": "#/$defs/partialDate"},
    "officialWebsite": {"type": "string", "format": "uri", "pattern": "^https?://"},
    "descriptions": {"$ref": "#/$defs/localizedNames"},
    "externalIds": {"type": "object", "additionalProperties": {"type": "string", "minLength": 1}},
    "firstPublishedIn": {"type": "string", "pattern": "^[0-9]+\\.[0-9]+\\.[0-9]+$"}
  },
  "$defs": {
    "localizedNames": {
      "type": "object",
      "required": ["ja"],
      "properties": {"ja": {"type": "string", "minLength": 1}, "zh-CN": {"type": "string"}, "en": {"type": "string"}},
      "additionalProperties": false
    },
    "localizedAliases": {
      "type": "object",
      "properties": {"ja": {"type": "array", "items": {"type": "string"}, "uniqueItems": true}, "zh-CN": {"type": "array", "items": {"type": "string"}, "uniqueItems": true}, "en": {"type": "array", "items": {"type": "string"}, "uniqueItems": true}},
      "additionalProperties": false
    },
    "partialDate": {
      "type": "object",
      "required": ["value", "precision"],
      "properties": {"value": {"type": "string"}, "precision": {"enum": ["day", "month", "year"]}},
      "additionalProperties": false
    }
  }
}
