{
  "schemaVersion": 1,
  "id": "label_000059",
  "kind": "label",
  "names": {
    "ja": "AVOPEN",
    "zh-CN": "AVOPEN",
    "en": "AVOPEN"
  },
  "parentOrganizationId": "maker_000002",
  "status": "unknown",
  "officialWebsite": "https://moodyz.com/works/list/label/9483",
  "externalIds": {
    "moodyz.label": "9483"
  },
  "firstPublishedIn": "0.4.2"
}
