{
  "schemaVersion": 1,
  "id": "label_000078",
  "kind": "label",
  "names": {
    "ja": "背徳ビチョビチョ！NTR大放出",
    "zh-CN": "背德湿透！NTR大放出"
  },
  "parentOrganizationId": "maker_000001",
  "status": "unknown",
  "officialWebsite": "https://ideapocket.com/works/list/label/10151",
  "externalIds": {
    "ideapocket.label": "10151"
  },
  "firstPublishedIn": "0.4.2"
}
